{
  "schema_version": "1.0.0",
  "contract": "games-web.character-sheet",
  "generated_at": "2026-07-10T18:41:00Z",
  "character": {
    "name": "Pip Gravelton",
    "class": "Miner",
    "level": 1,
    "title": "Fresh Recruit"
  },
  "stats": [
    { "key": "strength", "label": "Strength", "value": 5 },
    { "key": "endurance", "label": "Endurance", "value": 5 },
    { "key": "haste", "label": "Haste", "value": 3 },
    { "key": "luck", "label": "Luck", "value": 1, "hint": "Rare-ore proc chance" },
    { "key": "yield", "label": "Ore Yield", "value": "x1.0", "hint": "Multiplier on mined ore" },
    { "key": "armor", "label": "Armor", "value": 0 }
  ],
  "gear": {
    "head": null,
    "chest": { "name": "Threadbare Tunic", "rarity": "common" },
    "hands": null,
    "legs": null,
    "feet": { "name": "Worn Clogs", "rarity": "common", "icon": "🥾" },
    "main_hand": { "name": "Rusty Hand Pick", "rarity": "common", "icon": "⛏️", "power": 3 },
    "off_hand": null,
    "trinket": null
  },
  "skills": [
    { "key": "prospecting", "label": "Prospecting", "level": 1, "xp": 0, "xp_max": 100 },
    { "key": "tunneling", "label": "Tunneling", "level": 0, "xp": 0, "xp_max": 1 },
    { "key": "smelting", "label": "Smelting", "level": 5, "xp": 4000, "xp_max": 4000 },
    { "key": "gemcutting", "label": "Gem-Cutting", "level": 0, "xp": 0, "xp_max": 1 }
  ],
  "structures": [
    { "key": "shaft", "label": "Main Shaft", "tier": 0, "status": "locked" },
    { "key": "smelter", "label": "Ore Smelter", "tier": 0, "status": "locked" },
    { "key": "vault", "label": "Storage Vault", "tier": 0, "status": "locked" },
    { "key": "cartline", "label": "Cart Line", "tier": 0, "status": "locked" }
  ]
}
